date,text,score,title
07/18/2024 09:10,"i've noticed pouches with synthetic nicotine (like fre) don't hit as hard as nicotine salt pouches. could just be me, but i've noticed it with other synthetics too (sesh and nic-s)",3,american zyn nicotine pouches have to have something else in them
08/01/2023 02:15,"this long long long reply  will not be read but ima type it anyways even though 5 to 10 words could do it hahahajaha but.....no it does not have to be the upper lip....zyn will even tell you it really don't matter (had to talk to cs way to much so glad there is more brands out compared to 4 5 years ago) on! same way sesh cotton mouth actually suggests lower vs upper because it absorbs faster....the upper lip thing has more to do with being discreet than ""proper use"" ....lower lip looks like chew looks like chew can't be used in tobacco free zones (even though there is no tobacco) so get around so they can truly say it can be used anywhere is to say it must be the upper lip so ppl just go with it l....pretty much the same as op is saying about their friends they seen it done one way so thats the way they do it.....but nic salts (what is in 99.9 pouches sold) is delivered sublingual/buccap aka throw the little blood vessels in you mouth...really wanna kick right was put it under your tongue fir a few lmfao please don't lol you might or might not like it to much",1,am i putting pouches in wrong?
02/26/2024 20:52,they are my favorite mango. i wish sesh mango was as good as lucy is,2,anybody ever had these? picked these up at a gas station. i like em
04/22/2023 11:47,"haven’t tried the sesh, but the nic-s pouches are probably my favorite sold in the us",4,anybody have a take or impression on sesh+ or nic-s?
04/21/2023 17:47,"i was thinking about making a post about this just now hahahahaha.i order on nicokick, and the sesh+ are 3 for $3. i just got my shipment today. put in one 8mg wintergreen of the sesh and it was good, i'll edit this post again tonight/tomorrow after packing a few more.i also got the nic-s, and iirc a few months back i packed several cans and they are on of my favorites.edit: yea for $1 a can on nicokick the sesh+ are great. nic s great as well. also got a lix mix pack and a 15mg fre wintergreen",3,anybody have a take or impression on sesh+ or nic-s?
04/22/2023 07:39,fré &amp; l!x are the main brands i get there. that’s funny. i almost mentioned that too. i suppose i’ll give it a try then.,3,anybody have a take or impression on sesh+ or nic-s?
04/23/2023 04:48,sesh was mediocre i thought.  they felt stiff and not like powder. i liked lix. flavor lasts forever.,2,anybody have a take or impression on sesh+ or nic-s?
04/23/2023 19:56,"l!x has great flavor longevity, yeah.",1,anybody have a take or impression on sesh+ or nic-s?
07/19/2023 17:19,you’re dead right. i’m so happy i only a paid $1 for these.,1,anybody have a take or impression on sesh+ or nic-s?
05/01/2023 09:00,little disappointed in nic-s berry. flavor is kind of weird compared to most brands.,1,anybody have a take or impression on sesh+ or nic-s?
05/28/2023 19:18,are they spit free?,1,anybody have a take or impression on sesh+ or nic-s?
07/19/2023 17:19,i’m not sure i’d go that far but it wasn’t voluminous. you could get away with not spitting probably if you’re careful.,1,anybody have a take or impression on sesh+ or nic-s?
07/21/2023 12:42,l!x is top tier. but nothing beats rouge !,1,anybody have a take or impression on sesh+ or nic-s?
07/19/2023 17:20,you can beat the fuck out of it.,1,anybody have a take or impression on sesh+ or nic-s?
07/21/2023 12:41,nics is great. sesh is mehhh.. very nasty taste in my opinion but you may like it! the mango was gawd awful. the wintergreen is pretty good. nics are all great but be mindful the pouches break pretty dang easy.,1,anybody have a take or impression on sesh+ or nic-s?
07/22/2023 09:03,"this is helpful info as i had the mango in my cart, i think i’ll skip the sesh and try a few of the nic-s. i’ve heard bad things about the fre like it tearing up lips really bad. i currently use rogue, on and zyn. rogue and zyn definitely have the best flavor, the coffee zyn is too good. and the rogue nailed it with the cinnamon, honey lemon, and mango. looking for higher nic level pouches though, on is ok but the only good flavor on has is the coffee. the other flavors are just so bad",1,anybody have a take or impression on sesh+ or nic-s?
06/25/2024 13:45,the brand sesh has 4mg pouches.,2,anybody try this brand?
10/12/2023 21:02,"i disagree with the other comment, i think the burning in your throat from nicotine pouches is not typically acid reflux, it is the nicotine itself irritating your throat. i find that some pouches do it worse than others, and zyns are some of the harshest in that regard. pouches that are milder are lucy, nic-s,  sesh, and to a lesser extent velo. the best solution i can recommend is swallowing your spit with a bit of water when you have a pouch in, as it goes down easier and doesn’t burn on the way down. or even better is just spitting your salive if the situation allows, that way you dont swallow it to burn in your throat",5,anyone else have throat pain/irritation?
07/19/2024 18:47,was scared away by this sub tbh. i like lucy and sesh. happy for you tho &lt;3,2,anyone else still a fan of rogue?
08/07/2024 13:19,"on! is a great brand. i've tried them all; zyn, velo, and even a sweden brand called sesh. the on! brand always have loose powder within the container. at first i thought it was a busted pouch, which i have confirmed is never the case. it's either that the material used for the pouches is porous enough to let powder through easily, thus meaning you're actually getting less nicotine per pouch, or...it's part of their manufacturing process where some extra powder gets dropped into the container somehow. either way, on! is great. they're super small, won't burn your throat as much as some other brands, and as others have mentioned, won't make you salivate like an animal with rabies.",2,"are on! pouches supposed to have loose ""powder"" in the can? "
07/14/2024 18:37,sesh mint is my favorite,6,best mint pouch?
07/14/2024 19:02,"second for sesh, also lucy and the mango for both brands is very good as well",3,best mint pouch?
07/14/2024 19:30,i can attest! sesh mint has been my favorite now,3,best mint pouch?
07/16/2024 21:21,"i recently started trying some other brands and ran into sesh at a local store. i tried wintergreen and it was okay, but the mint is great. i’m really surprised i haven’t heard a lot more about sesh on here…just a handful of mixed reviews.",2,best mint pouch?
07/16/2024 21:26,"yeah, i find it odd that sesh isn’t mentioned more often here. i find it to be a high-quality product.",2,best mint pouch?
11/15/2023 19:16,[chris travis had some negative things to say about bones](https://www.reddit.com/r/teamsesh/comments/yir9lw/chris_says_fuck_bones_and_el/),1,"bones is my biggest inspiration on life. he keeps producing more flows and rhymes, showing us the endless potentials."
04/23/2023 18:10,"sorry if this isn’t the right place.not sure if ya’ll have seen or not - but sesh has a nicotine gum that is selling at shell + circle k locations across canada. they have a display on the countertop. i’m wondering why np’s that are 4mg/3mg aren’t allowed to be sold then? np’s are still a natural health product in canada, no? any help would be great :)",3,canada law question
06/23/2024 16:31,"i buy all my nicotine pouches online and while i mostly get zyn (i have over 1000 points on their rewards), occasionally i will get some other brands they carry because they are cheap and i like trying new ones.none of them really compare to zyn. zyn is the best and even though they have only 15 per container. (20 is standard).my rankings from favorite to least favorite:favoritezynon!veloseshzoneroguejuice headleast favorite",2,can anything compare to zyn ?
07/10/2024 09:47,"american velo is trash. honestly american zyn is the best they have at gas stations and whatnot around here.that's why i decided to finally just order some stuff off nicokick. got a bunch of lucy and sesh coming. lucy seemed better the one time i tried it, but it did say ""made in sweden"" on it.so i think the truth is you just have to get swedish pouches.",2,can someone give me a good alternative to zyn??
07/10/2024 09:20,"lucy seems to be the only one i found that i really enjoyed other than zyn. on, velo and rogue suck! although i've only had the breakers which may not be for everyone. i liked the quality of them enough that i put in an order online for a bunch of regular lucy cinnamon, apple ice and wintergreen. cause they're impossible to find in the wild.i also got some sesh wintergreen, but i haven't gotten them yet. i can let you know though how they compare.so ya zyn were the only ones i liked until i tried lucy. unfortunately you'll have to order online too.",2,can someone give me a good alternative to zyn??
03/25/2024 21:30,"my go to website has them for $2 and thats the price point i usually try to stock up at. most importantly how does strength line up with on! and zyn (9 mg sesh seems to hit me the same as 6mg zyn) where 6-8 is usually my preference and i want to make sure their 6 is enough. besides that i'm not picky but i prefer smaller pouches like on/fre and i think lix was good, i only like menthol flavors so i dont really care if their dragon fruit cooked your gums but which of those minty flavors is the best, they have have like 3 different kinds of minty stuff. i saw that they're wet which is my preference anyway. sorry for long post i just wanna make sure i don't stock up on something thats ass (juicehead)",2,can someone give me the lowdown on zone before i buy?
05/16/2023 07:06,i am also a zyn enjoyer. i usually look for deals and only keep a handful of zyn cans on hand when they aren’t cheap. the 15 pouch quantity is annoying too aha. zyn are unfortunately the most fully satisfying nic pouch experience that i’ve had thus far. zyn menthol are soo good.i bought a ton of sesh mint and they are alright. 6ish/10 compared to zyn 9/10 imo northerner and prilla run deals sometimes too. i have also noticed that there are only a few domestic nic pouch vendors and very few options compared to what’s available internationally which is odd. anyone know why this is?,1,cheapest place to get zyn?
12/04/2023 12:31,nah i use sesh and they aren’t dry,-2,chewing pouches
07/10/2024 15:22,"ya zyn can make me nauseous but i also have a lot of stomach problems and probably a damaged vagus nerve. i'm getting some lucy and sesh soon and hoping i like them better because i'm sick of zyn, and honestly i just feel like i can do better, but unfortunately i live in the us and we have the worst brands like on and velo.",9,does zyn make anyone else feel ill?
07/10/2024 19:38,"i recently switched over to sesh, dig the mango flavor. it’s definitely easier on my gums, stomach, etc. it doesn’t hit as hard as zyn, but if you lightly chew it a bit after parking it, the nicotine and flavor release quickly. i hope you enjoy them, good luck",1,does zyn make anyone else feel ill?
06/13/2024 13:18,it happens when i do too much in a day. i do 3 6mg peppermint. any more than 3 times a day and my stomach will not be appreciative. sometimes it happens on the 3rd sesh.,1,do zyns ever just randomly kick your ass?
06/09/2023 12:05,"idk, i just started moist pouches. sesh irritated the hell out of my mouth. really sucks because i bought 50 of them for $2 each on nicokick.",2,favorite brands/flavors
06/05/2024 13:17,"what i did was kind of dumb.i used to use nicotine pouches regularly for like 8 months last year and finally quit.last month i moved and thought i'd treat myself and buy a little tin of pouches and thats it. i ended up buying more throughout the week but came to my senses and stopped (that was about 3 weeks ago).then over this past weekend, i was like ""hey you havent had a black and mild in like a decade maybe try one of those as a little treat"" so i did. i ended up having two more the next two nights before finally being like ""ok this is stupid"" and stopped a few days ago.over the last few days i have had really significant brain fog and fatigue. i later realized that these fucking baby cigars have 100-200mg of nicotine in each of them. thats like 5x the amount of nicotine i used to get over the course of a day using the fucking pouches, all in the span of like one 10 minute walk sesh. also i inhaled most of the cigars, stupid i know but i wanted the buzz i guess. i had no idea these were so nicotine packed.i'm assuming this is contributing to a way more intense withdrawl yeah?how long will this shitty feeling last? obviously thats a shit ton of nicotine compared to my prior habit, and obviously inhaling cigar smoke is bad bad, but still im shocked my brain is this foggy after 3 uses. and it doesnt even feel like cravings which is the weirdest part. theres no part of me that feels tempted to go back to smoking cigars, but my brain is just like something is missing.",2,feeling significant withdrawls/brain fog after a few cigarillos?!
06/05/2024 14:52,"over this past weekend, i was like ""hey you havent had a black and mild in like a decade maybe try one of those as a little treat"" so i did. i ended up having two more the next two nights before finally being like ""ok this is stupid"" and stopped a few days ago.over the last few days i have had really significant brain fog and fatigue. i later realized that these fucking baby cigars have 100-200mg of nicotine in each of them. i used to use nicotine pouches (quit like a month ago) and thats like 5x the amount of nicotine i used to get over the course of a day using the fucking pouches, all in the span of like one 10 minute walk sesh. also i inhaled most of the cigars, stupid i know but i wanted the buzz i guess. i had no idea these were so nicotine packed.i'm assuming this is contributing to a way more intense withdrawl yeah?how long will this shitty feeling last? obviously thats a shit ton of nicotine compared to my prior habit, and obviously inhaling cigar smoke is bad bad, but still im shocked my brain is this foggy after 3 uses. and it doesnt even feel like cravings which is the weirdest part. theres no part of me that feels tempted to go back to smoking cigars, but my brain is just like something is missing.ive also been dealing with some possible dust allergies, so it could be that as well, but my dust allergies have never been this bad ever. maybe it's both too! ahhhhgh",3,felling significant withdrawals and brain fog after a few black and milds??
03/27/2024 16:47,"a good friend of mine that i've known from the snus world for 15 years was one of the creators of that brand.  really good dude, they put a lot of work into this brand.  really high quality stuff.",9,"first time trying sesh, never even heard of the brand. a friend bought these for me. i like them! (i usually use rogue or zyn)"
03/27/2024 16:49,glad to know the snus king him self can vouch for the quality of sesh. have you done a video on sesh?,4,"first time trying sesh, never even heard of the brand. a friend bought these for me. i like them! (i usually use rogue or zyn)"
03/27/2024 16:52,"i haven’t, it’s been ages since i had it.  i tested it when they were first making it, so i didn’t review it then.",3,"first time trying sesh, never even heard of the brand. a friend bought these for me. i like them! (i usually use rogue or zyn)"
03/27/2024 19:13,their nicotine gum is fab,3,"first time trying sesh, never even heard of the brand. a friend bought these for me. i like them! (i usually use rogue or zyn)"
03/27/2024 16:46,"more contexts i usually use general snus, rogue, or zyn. these remind more of actual snus.",1,"first time trying sesh, never even heard of the brand. a friend bought these for me. i like them! (i usually use rogue or zyn)"
08/14/2024 12:47,"just picked some up they look fire, about to toss one in",1,"first time trying sesh, never even heard of the brand. a friend bought these for me. i like them! (i usually use rogue or zyn)"
03/27/2024 19:48,have one can coming my next order. try em out,1,"first time trying sesh, never even heard of the brand. a friend bought these for me. i like them! (i usually use rogue or zyn)"
03/27/2024 20:48,"i bought some and was about to try it until i found out it has wheat fiber (alba fiber)… sucks to have celiac and a wheat allergy, but glad i checked since i already made that mistake once with another pouch. i will just live vicariously though y’all.",1,"first time trying sesh, never even heard of the brand. a friend bought these for me. i like them! (i usually use rogue or zyn)"
03/28/2024 00:52,i wonder what that does in a pouch seems so weird to have to look for gluten free pouches. edit:(oh wait maybe the fiber it's made out of? if not i'm completely confused here 🤣),1,"first time trying sesh, never even heard of the brand. a friend bought these for me. i like them! (i usually use rogue or zyn)"
03/28/2024 06:43,"i believe it’s part of the filler, not sure it’s the main filler though on these. others i think it’s a main bulk of it. and yeah, it feels really stupid to have to look at that but (at least on american pouches) there’s no actual requirement to list ingredients or even allergens (granted fda may not realize anyone is using allergens yet). granted it may be fine for celiacs as i never had any celiac reactions with the other pouch but my hands broke out for weeks before i realized it was wheat based. then again i am apparently not very sensitive to gluten compared to how some celiacs can be.",2,"first time trying sesh, never even heard of the brand. a friend bought these for me. i like them! (i usually use rogue or zyn)"
05/23/2024 11:59,"hey, random question. i currently am trying to get off vaping and want to try nicotine pouches. i also have celiac, can i ask you which ones are gf in your experience?",1,"first time trying sesh, never even heard of the brand. a friend bought these for me. i like them! (i usually use rogue or zyn)"
05/23/2024 19:48,"in the us velo, rogue, zyn, and i believe on should all be safe. generally it’s pretty unusual to find ones that are not. swedish ones all have very good labeling on them with e numbers so it’s easy to tell what is used in them. generally in the us i would stick with big tobacco owned brands and they are insanely particular with what goes in products. if a company discloses their ingredients you likely are good as well but if they just say “plant fiber” i would reach out to them to verify as labeling requirements for ingredients don’t exist in the us tobacco laws at this point.",1,"first time trying sesh, never even heard of the brand. a friend bought these for me. i like them! (i usually use rogue or zyn)"
03/28/2024 14:07,they look good my normal is zyn and rogue too,1,"first time trying sesh, never even heard of the brand. a friend bought these for me. i like them! (i usually use rogue or zyn)"
07/25/2024 20:59,"these are pretty good but hit and miss. the buc-ee’s stores carry these…i think i read they had some exclusive brand partnership. i got some wintergreen and it tasted okayish and had pouches that were pretty stiff and stuck together in one clump (they weren’t expired according to the date). gave it another try with the mint, and the pouches were nice and soft and not in a brick. it tasted pretty good too. i would be more apt to go for these as a regular if i could guarantee the pouches were soft and not dried out.",1,"first time trying sesh, never even heard of the brand. a friend bought these for me. i like them! (i usually use rogue or zyn)"
09/08/2023 18:08,"fre is in my top 5 for sure, along with zyn and i really do enjoy on! as well. i mainly like mints and menthol. zyn is just so expensive and only 15 pouches. juice head was very mediocre when i tried it plus the pouch texture is not enjoyable imo. i didn’t enjoy sesh very much either.i really only buy zyn these days if it’s on sale or in a pinch locally. i’m hoping we get more options in the next few years in the us. international market has so many different options comparatively",3,fre mega tins
07/30/2023 01:34,"ordered some from nicokick cause they were on sale. they are hard like sesh pouches and kinda sticky. not horrible. but, is it normal they have more than 20ct in them? first one had 22 and second had 21. 3rd has 23. yaaay me i guess! most manufacturers crack down on quantity control.",5,fre pouches
07/30/2023 19:50,"i noticed they're harder than sesh to crush. it's like a hard paste. not the typical powder. i've tapered down mg vaping for 7 years and have been vaping 3mg for 4 years. higher mg just gives me headaches. rogue is juicy af but irritates my teeth and gums randomly. lix are perfect for me. wasn't a fan of sesh,zyn,on,valeo. juice head took a while to get used to the flavor and is mediocre.",1,fre pouches
02/27/2024 12:29,"dragonfruit is the best velo imo, my go to for a subtle sweet flavor when i don’t want mint. you would probably like lucy mango, they’re moist and bigger pouches than zyn, i like the mint. i want to try sesh and nic-s on my next order!",2,got my nicokick order!
02/27/2024 19:06,sesh wintergreen is my favorite nic pouch,1,got my nicokick order!
07/30/2024 16:07,"lab and fumi are the only brands i know off hand . they are european , i think sesh may not use ace k as well but not sure",2,gum irritation not where i place pouches
