date,text,score,title
10/14/2023 17:28,"im an exclusive mint person so i can’t speak to fruit flavors but my favorite brands since lix died have been sesh (the mint is decent as well, but not amazing) but mostly lucy. they are on discount on nicokick at the moment and do have plenty of fruit options so i’d say give em a tryedit: especially the lucy breakers, i like the mint ones but i bet the fruit ones are fire if you’re into that sort of thing",1,l!x (lix) pouches discontinued
12/06/2023 19:31,"every pouch i have tried is trash compared to lix. sesh, zyn, on!, velo, rogue, lucy, fre. none of them give the kick. no good flavors. is there any way to get lix to usa ??",2,l!x (lix) pouches discontinued
12/06/2023 20:11,"nope discontinued, but tjp labs is going to start making new ones in 2024. the closest i have found are lucy, sesh, and nic-s (expensive). it sucks tho, i miss them.",2,l!x (lix) pouches discontinued
07/14/2024 17:30,sesh mint is my favorite. best i’ve had thus far.,1,mint that doesn’t taste like salt?
07/23/2024 03:50,i get 25 pks of wintergreen sesh from nicokick,4,never buying us nps again…
07/23/2024 11:41,"how did you get shipping so cheap?they want to charge me $30 to ship to texas. been using sesh as they're soft and moist, unlike us zyn and on, but would love to try swedish zyn.",2,never buying us nps again…
07/23/2024 15:42,how are those sesh pouches? compared to american zyn,1,never buying us nps again…
10/13/2023 18:58,"anyone know why nicokick charges 186% excise tax in california? my understanding was our excise tax for nicotine related products was 12.5%.... when i tried to order 9 cans of sesh for $9, they try to tax on $16.77 in excise tax. since it's 186% of the retail selling price perhaps it should be renamed excessive tax?california charges an additional 12.5% cet for nicotine.beginning july 1, 2022, retailers of electronic cigarettes (in-state or out-of-state) are required to collect from the purchaser at the time of sale the california electronic cigarette excise tax (cecet) at the rate of 12.5 percent (12.50%) of the retail selling price of electronic cigarettes containing or sold with nicotine. &amp;#x200b;[https://imgur.com/a/eqm2128](https://imgur.com/a/eqm2128)",3,nicokick excise tax in california - 186% of subtotal. how is this legal?
08/01/2024 21:50,sesh,2,nicotine pouches have been better for my personal health than vaping was. what’s your favorite nicotine pouch brand?
07/26/2024 14:16,"just got my first hookah and had a sesh with a buddy the other night, whats weird is he got a heavy buzz off of a few hits and had to put it down for a while. meanwhile i chain ripped the thing for the full hour and didnt feel close to anything, he also uses higher nicotine pouches and weighs more than me whats up with that?",1,no buzz?
08/14/2021 04:00,"its not wierd. vaping imo is better for regulating dosage, as long as your ""juice"" is dosed and mixed properly. the last time i used nicotine gum (which was to reduce my vape usage), i could tell the nicotine felt wayyy more concentrated than a vape.your not likely to use 6, 4, or even 2 milligrams of nicotine with 1 vaping sesh, but you can get a concentrated dose of nicotine absorbed through the stomach lining (your spit carries the nicotine). i eventually stopped using the gum and just tapered my vape dosage, because the nicotine gum was making me feel way to stressed.",0,observations and insights about nicotine as a nootropic from a former addict - good and bad
06/14/2024 16:04,mango sesh is the only mango flavor i did not like,1,online order 3
06/09/2023 11:56,"no, having the same damn problem. zyn doesn't affect my lips at all. it's really a shame that zyn is more expensive for only 15 pouches. has anyone with sensitive lips found an alternative? and omg do not try sesh, worst i've ever tried for irritation. my throat was messed up from it.",1,on! makes my lip scaly while zyn doesn't
07/16/2024 16:32,"lucy, sesh, zone, zeo for us based ones. when i order from sweden i usually get klint, but the swedish zyn’s are way better than us ones",9,"phillip morris announces $600 million zyn facility in aurora, creating 500 jobs"
07/16/2024 22:29,i wish the sesh ones were more widely available. only place i’ve seen them was at buccees up north.,3,"phillip morris announces $600 million zyn facility in aurora, creating 500 jobs"
07/16/2024 18:49,"100% i usually get big orders from snusme, but in between orders if i run out i go with any of those other brands. sesh is running a bogo deal right now so i got a stock of those. cool thing about all these new brands popping up is they run hot deals to get their foot in the door",3,"phillip morris announces $600 million zyn facility in aurora, creating 500 jobs"
06/11/2023 22:23,sesh is good,3,pouches that aren’t harsh on the gums
06/11/2023 16:57,"i've had sensitivity problems with zyn. others have been a lot worse, especially rogue l. if i stick with velo, fre, or sesh i'm totally fine.",1,pouches that aren’t harsh on the gums
06/21/2024 19:54,"i finally got my hands on some seshes at a buccees so i feel its time to ask you guys what your favorite is, my personal ranking is the order of the poll with zyns being my favorite, would be happy to answer any questions if you are interested in my opinion on the lesser known varieties :)[view poll](https://www.reddit.com/poll/1dlibxd)",2,ranking (most) of the nicotine pouches available in the states
05/23/2023 16:13,zyn lucy sesh are my top 3 all available on nicokick if in usa,1,recommendations for other brands than velo and lyft?
05/23/2023 18:16,how does sesh compare to zyn? been wanting to try but every time i try something other than zyn it’s not as satisfying.,2,recommendations for other brands than velo and lyft?
03/17/2024 06:48,i’ve been using sesh pouches if your in usa they’re my favorite brand that’s not overseas. i don’t know why but they don’t get much mention,1,recommendations 
06/08/2024 15:13,"i'm a user of nicotine gum and pouches, and trying to look for products beyond the samey variety of tastes like what nicorette already offers or that you could find in regular chewing gum already.my regular buys have been on!'s coffee flavor or sesh in mango. it'd be sorta fun to branch out to something that comes in like individual fruits/berries, chocolate, vanilla, etc. or just about anything else that's closer to stuff more foody or tea/coffee &amp; mocktail flavors. i'm not picky.(pouches like i've seen advertised as elderflower, dragonfruit, cactus sour, arctic blue gin, pine, etc. sounded interesting to me but wanted to see what others could suggest before pulling the trigger on purchases.)",2,"recs for good flavors outside of mint, cinnamon or fruit blends"
02/25/2024 14:29,i’ve been stuck on these. a little less gum burn than fre which is nice and absolutely no throat burn imo. still has the same weird powdery taste as fre but definitely my favorite pouch right now. nic-s is very similar to these but the flavor isn’t as good. i tried to post a review of these but my karma isn’t high enough to post in this group lmao.,5,good morning sesh with sesh
02/24/2024 15:52,i really wanna try these... have to hope they will get them in the eu,3,good morning sesh with sesh
02/25/2024 19:56,my hands down favorite of anything readily available in the us.,2,good morning sesh with sesh
06/19/2024 14:31,sesh clear pouches weren’t bad at all. felt pretty soft and comfortable. i need to try the flavored ones 😆,1,good morning sesh with sesh
02/29/2024 04:36,"ב''ה, browsing here has me seeing what's around, apparently the gimmick with sesh is that they're ""chewing gum like"" to give a release more like.. literal chewing tobacco or gum?  so if they die quick apparently chewing is encouraged and if that works properly, instead of getting a your-actual-gumline-ruining mouth burning blast of nicotine at once, you can wait, give a careful chew on it, ""re-up"" off the same pouch and do that every 15-30 minutes or so until it's really exhausted or you're satisfied.  interested in trying the rogue gum for the same reason and because some no pouches workplaces are still okay with gum as it's a ""quitting"" product.",1,good morning sesh with sesh
02/11/2024 14:17,finally a normal product and not some “extreme blueberry iced mint 50 mg” garbage.,7,sesh doesn’t get much mention around here.
02/11/2024 14:25,lol. i know right? part of my issue with what they did to vaping and what’s “popular” with pouches. it always starts with good intentions with adults looking for less harmful ways to consume nicotine and ends up with a bunch of “new” people looking to “catch a buzz” it ruined the vaping community/industry and will probably eventually kill this here in the us at least. i try to stay off of soap boxes because nobody cares but the over simplification of the evils of nicotine &amp; how the powers that be lean into it for prohibition purposes when nic had nothing to do with what made smoking so harmful to begin with. it should be respected and consumed responsibly however. but when i saw the “kids” start vaping without having been smokers looking for 50-60mg liquids just ‘cuz. now it’s transitioning over here for people that never smoked or vaped it just drives me absolutely mad.,3,sesh doesn’t get much mention around here.
02/11/2024 14:52,"you’re pretty much took all of the words right out of my mouth lol. i started vaping senior year of high school (after first smoking cigs at 14) with cig a like vapes and moved up from there all the way to cloud blowing mods then eventually i hopped on the juul train and that sent my nicotine tolerance way up. moved down to florida in 2019 and started having throat problems from all of the vaping high nic juul and vuse pods. then at some point i found out about nicotine pouches and snus and nic pouches and started using zyn wintergreen and general mint. i eventually stopped nicotine pouches altogether, and switched over to regular swedish snus which still is doing me well. i tried to go back to vaping for a little while but it didn’t stick and i don’t see myself ever going back again, plus as you said one of the biggest problems with vaping now is that it’s geared towards high nicotine, fruity, disgusting, flavored disposables and nic salt. i hope nicotine pouches don’t follow the high nicotine disposables but that seems to be where some brands are heading. i have no idea how people use some of these pouches that are 20 30 or 50 mg of nicotine.🤢",3,sesh doesn’t get much mention around here.
02/11/2024 15:24,"thank you!! finally someone i can exchange these stories with. i’m estimating i’m older than you but similar experiences. i smoked 2.5 packs a day from 18 to about 36. found vaping in 2013 with an old school cigalike, transitioned to super over priced og blu kits. found the og vape reviewers on youtube and dove all the way in. suffered through all the earlier crap technology and was a halfway decent reviewer myself. we actually learned a lot about nic titration, safe voltage and battery limits etc. got too far in to the “cloud chasing” fad and dropped my nicotine too low too fast and actually fell off the wagon &amp; went back to cigs for about a year stupidly. juul actually did reel me back home but 65mg was too much on a long term and unlike most people high nic gives me serious fatigue and makes me really tired. juul served a good temporary purpose because damn their mint was 🔥 and it was a similar enough experience to make me put cigs down for good. finally i settled into decent pod systems and sensible 10-20 mg mint flavored salt. after so many years of that i realized i wasn’t enjoying it anymore. i tried swedish snus for a while, then some pouches and was duel using. finally a couple of months ago vaping just became a thing i did…and the sensible thing is why inhale something extra into your lungs if you don’t even enjoy it. unlike most people giving up nic isn’t a reason i decided not to vape. so i’m very pleased to have found some decent strength &amp; subdued flavors that i enjoy during the day and evening. the difference between our approach &amp; theirs is having a habit &amp; looking for ways to sensibly &amp; safely enjoy…compared to purposely trying to pick up a habit at an insane level that simply isn’t necessary. nobody started smoking to start a dependency. it’s all so backwards. the over the top fruity flavors are further proof one would be looking to jump into it as a “fun” thing to do. and sadly, gives credence to the prohibitionists that want to kill everything designed for responsible adult consumption because of “the kids”. this ain’t the place to look for a “buzz” so damn ridiculous.",2,sesh doesn’t get much mention around here.
02/12/2024 11:04,i'm a simple man that likes simple things. sesh looks simple enough for me lol,2,sesh doesn’t get much mention around here.
02/11/2024 23:11,sesh mentioned 🗣️‼️,5,sesh doesn’t get much mention around here.
02/12/2024 07:15,💯,1,sesh doesn’t get much mention around here.
02/22/2024 11:36,"really appreciate this everyone. we work so hard on our products, and i'm really happy more people are starting to notice. i was originally a snus user, then vaper, i always had this dry cough and chest pain, then someone introduced me to a nic pouch in canada (whitefox) which i loved. the only drawback was that it would start to tear up my gums and the menthol was so intense. that's where this all started 5 years ago, we've come a long way...",2,sesh doesn’t get much mention around here.
02/22/2024 17:20,you’re doing a great job. the fact they’re manufactured in sweden makes a world of difference imo. much closer to the brands i’ve imported over the years but ended up being cost and time prohibitive. much continued success.,1,sesh doesn’t get much mention around here.
02/22/2024 17:28,"thanks, great to know that people care about the fact it's made in sweden. it matters to me, but we've had so many offers to move to facilities in china or india but anytime i've tried samples the quality diff. is so noticeable to me. obviously, shipping is more expensive, and we're looking at either us/cdn facilities as we grow but for now we're sticking with sweden.",3,sesh doesn’t get much mention around here.
02/22/2024 19:26,"agreed. it’s never the same. one of your competitors switched to china manufacturing and it’s not as good. i can’t speak for this whole sub but i know offline a lot of people only want swedish made products. bottom line is they know it better than anyone. zyn for the us market is horrible in my opinion and was blown away when i had the genuine article for the first time. i had tried snus initially in an effort to quit vaping which i did to quit smoking but the overseas shipping and wait time just didn’t make it stick. this time i was able to completely switch and so happy i found sesh. i think you’ll find there a lot of people that will find your product that understand the quality that sweden produces although they may be in smaller pockets scattered around the forums. but they’re out there. sorry for the wall of words, but thanks for all you’re doing in this space. oh…one more thing. your flavorings don’t taste like pure sucralose and don’t leave a weird aftertaste either. that’s damn near worth the price of admission in and of itself.*edited to say - i don’t mind paying a bit more to absorb higher shipping costs.",2,sesh doesn’t get much mention around here.
02/11/2024 16:57,are they dry or moist pouches ?,2,sesh doesn’t get much mention around here.
02/11/2024 17:09,moist. and packed nicely.,3,sesh doesn’t get much mention around here.
06/03/2024 22:53,just bought my first in texas bucees offers buy one get one free,2,sesh doesn’t get much mention around here.
06/15/2024 21:41,nice. you know if they're still running that deal? also what was the price per can? ,2,sesh doesn’t get much mention around here.
06/18/2024 15:50,same story as above this past saturday. 2 for one 5.37 after tax i believe,2,sesh doesn’t get much mention around here.
06/18/2024 16:38,i might have to make the 30 minute drive and go get me some. thanks for the heads up.,1,sesh doesn’t get much mention around here.
06/22/2024 14:30,yep just got two today from buccees!,2,sesh doesn’t get much mention around here.
02/10/2024 15:29,i may have to order some the next time i place an order on nicokick. i really like lucy and zynz.,2,sesh doesn’t get much mention around here.
02/10/2024 15:35,"i do enjoy lucy also, and went back &amp; forth for a while. but i do think this edges them out a bit. also i believe lucy moved their standard pouch production to china so this is kind of a plus. they were running a deal on nicokick last week. might still be on. i recommend it.",1,sesh doesn’t get much mention around here.
02/10/2024 15:44,"20 pouches is a huge plus, too. that is why i wanted to try juice heads. my personal opinion is that they are not as bad as people say. however, it's not good enough to make me excited about the cost and pouch amount to ditch zyns over them.",1,sesh doesn’t get much mention around here.
02/10/2024 15:51,excellent point i forgot to mention! and over the course of a decent size order goes a lonnnnnng way!! 👏🏻 never tried juiceheads but wasn’t interested in them. i vaped for a long time and their liquids were just always too sweet for me. i’m sure they’re ok like you said. but i went from cigarettes to vaping to pouches. it might be a maturity thing but all i want is something kind of mellow that i can enjoy all day. i used to vape mints &amp; menthols so there it is. nic enjoyment should be in the background. not in your face and overbearing as far as i see it.,1,sesh doesn’t get much mention around here.
02/10/2024 16:20,"same way. went to vaping to get off the smokes. started pouches to wean off vaping and just have something mellow and discreet that i won't use all day. juice head juice wrecked my coils all the time, and i used to build my own coils. their pouches are a bit on the sweet side. the pouch size is great.  the flavors are meh. i didn't release all of them where mint so it makes it a too sweet mint. i see sesh has mint, mango, and wintergreen. that's prefect. my favorite pouch right now are lucy wintergreen and zyn chill.",1,sesh doesn’t get much mention around here.
02/11/2024 09:41,made in sweden but only available in the us it seems. i wonder if this is another swedish pouch rebranded.,3,sesh doesn’t get much mention around here.
02/22/2024 11:41,"it's not rebranded, it's a proprietary formula and we actually have a granted patent on the gumbase we use in our pouches which gives it a softness and chewiness and helps deliver the nicotine more efficiently. we partnered with the 'godfather' of nicotine pouches, thomas ericsson, on our formula.  thomas is the original inventor of zyn, dryft, nordic spirit pouches along with assisting on many other formulas you see in europe and the us today. i always loved the swedish pouches, but i could never find them in the us and so we wanted to bring that spirit to the us &amp; canadian markets. we only have regulatory filings in us on it but europe is definitely something we might explore in the future.",4,sesh doesn’t get much mention around here.
02/22/2024 17:23,"welcome to our sub, and thanks for chiming in with input on your brand!",2,sesh doesn’t get much mention around here.
02/22/2024 17:39,my pleasure! it's really helpful getting this feedback and it gives us that extra push hearing you guys talk about it.,3,sesh doesn’t get much mention around here.
05/11/2024 00:13,okay you've sold me. what's your favorite flavor?,1,sesh doesn’t get much mention around here.
02/11/2024 09:53,that would actually make a lot of sense. it’s kind of a hidden gem in the us it seems. definitely not your typical product made for standard us consumers.,1,sesh doesn’t get much mention around here.
02/10/2024 22:17,have you tried all the flavors? i’m looking to order some to try when i order my next month supply from nicokick. i used lucy for a long time but went to zyn when i dropped my nicotine down to 6mg but i enjoyed the pouch style lucy uses vs zyn,1,sesh doesn’t get much mention around here.
02/10/2024 22:29,"only flavor of sesh i’ve tried is mint. i imagine i’d enjoy the wintergreen as well, as i did both with lucy. i think the flavor here of the mint at list is a bit more true and clean (if that makes sense) pouches are fairly similar. as moist if not a touch more. soft and packed nicely. much more satisfying than us zyn that’s for sure. i suggest trying at least a can or two of you liked lucy over zyn.",2,sesh doesn’t get much mention around here.
02/10/2024 22:35,thanks for the thorough reply. i’m gonna get a can of each flavor to try next time i order. i love lucy but i’m not ready to step down to 4mg yet. hopefully nicokick has the 3 for $10 pack back in stock by then,2,sesh doesn’t get much mention around here.
02/11/2024 00:02,"love sesh! made a post on it a few months back, havent had it for a few months either , wish stores around me carried it and i didnt have to order it everytime.",1,sesh doesn’t get much mention around here.
02/22/2024 13:28,"thanks! we're trying, launching with buc-ee's this month as our first major us chain.",3,sesh doesn’t get much mention around here.
02/22/2024 17:18,👏🏻,1,sesh doesn’t get much mention around here.
02/11/2024 00:20,i think it’s great! i wish they sold it in stores too. but i’m grateful i can at least get it on nicokick and don’t have to resort to international shipping.,1,sesh doesn’t get much mention around here.
02/10/2024 22:37,no problem! i understand that. 6 is a good sweet spot for me. i hope so too. it’s a pretty good deal.,1,sesh doesn’t get much mention around here.
02/11/2024 16:40,where do u find those?,1,sesh doesn’t get much mention around here.
02/11/2024 16:47,is that in canada,2,sesh doesn’t get much mention around here.
02/12/2024 06:41,i’m pretty sure the company is based in canada. i’m not sure the best way to get it there   [canada](https://seshproducts.ca),1,sesh doesn’t get much mention around here.
02/22/2024 12:23,"yes we are canadian based (vancouver) that's where i'm from, we only sell our nicotine gum in canada right now as we're still waiting for our pouch approval from health canada. we have a us subsidiary and 2 dcs that we sell our nicotine pouches from in the us. our pouches are made in our partner's swedish facility (helsingborg).",3,sesh doesn’t get much mention around here.
02/22/2024 17:17,nice! hey max. can’t believe you’re here. i actually follow you on linkedin. lol. loyal is customer here. i think you guys have a great product and it’s great to see a company dedicated to harm reduction.,1,sesh doesn’t get much mention around here.
02/22/2024 17:22,"haha that's awesome, and it means a lot. still relatively new to reddit but someone sent me the thread so i wanted to jump in.",2,sesh doesn’t get much mention around here.
02/22/2024 17:25,nice!! i’m glad this thread made it your way.,1,sesh doesn’t get much mention around here.
02/11/2024 16:46,[sesh](https://nicokick.com/us/catalogsearch/result/?q=sesh)they’re running a decent deal on them right now. 3 for $10. i really enjoy them.,1,sesh doesn’t get much mention around here.
12/20/2023 10:18,"hey, i need some help. i've tried a few brands and sesh+ wintergreen is hands down my favorite pouch. i can't find it anywhere in 6mg.i do not like zyn or juice head. i need something that i can leave in for an hour w/o losing the flavor. i work an extremely stressful job and need the constant nicotine kick during 45 minute windows.any ideas on what else i could try? rogue's spearmint is decent but the aftertaste is disgusting. juice head is a no go. nic-s is basically zyn. the flavor goes away in 15-20 mins... just want some advice.",2,sesh+ wintergreen 6mg is out of stock everywhere
12/22/2023 08:26,i compared sesh to fre. both aren't powder and kinda on the firm side. the only problem with fre mint and wintergreen has a flavor enhancer that burns until you get used to it. i found sesh to have muted subtle flavor. try velo. it's powder but the flavor isn't super strong.,1,sesh+ wintergreen 6mg is out of stock everywhere
06/11/2024 23:11,what can i expect for flavor or no flavor from sesh clear pouches. i like their mint and wintergreen. mango was okay. good for something different than mint flavored. thanks!,2,sesh clear
06/12/2024 00:47,clear is probably not flavored,1,sesh clear
06/19/2024 14:33,clear is suppose to have no flavor . i did notice a very very light hint of sweetness from the pouch.,1,sesh clear
03/27/2023 19:04,anyone try sesh nicotine pouches? i just received an email from northerner introducing them as new. i just made an order from them but might make another if they're any good.,7,sesh nic pouches? anyone?
03/28/2023 06:23,"i haven't tried them, they're made in sweden and apparently they make great snus so they might be alright. all i can say is stay away from the ""juice head"" brand, the pouches are huge and stiff and the flavor is just harsh and just realllly bad",10,sesh nic pouches? anyone?
04/03/2023 23:38,i agree with the juicehead comment. they’re literally awful.,3,sesh nic pouches? anyone?
04/04/2023 17:55,absolutely agree about the juice head. i tried two of the strawberry mint and tossed the rest of the tim.,2,sesh nic pouches? anyone?
