date,text,score,title
04/05/2023 00:39,"i tried to give mine to a friend and he hated them too, so i tossed mine as well. i'm really wary of anything they sell at a severly reduced price now. sometimes the local smokeshop has great deals on pouches",1,sesh nic pouches? anyone?
03/28/2023 11:25,i tried juice head when they were new. the only ones i liked were their peach pineapple mint and their mango strawberry mint. the flavor and nicotine in them seem to last forever. all their other flavors were really sickening to me.,1,sesh nic pouches? anyone?
03/28/2023 11:43,peach pineapple mint is the only one i tried,1,sesh nic pouches? anyone?
03/28/2023 11:48,"heh, well if you didn't like that then you'd probably puke from some of their others.",1,sesh nic pouches? anyone?
05/26/2023 21:19,"agreed on the juice head. tried one mango strawberry mint, had it in for about three minutes then tossed the rest on the tin in the trash. horrible stuff. my go-to are rogue. i think they're heads and tails above everything else, no matter what the flavor. mango, honey lemon and cinnamon are my favorites",1,sesh nic pouches? anyone?
07/22/2023 17:09,"those are my 3 favorite rogues as well! rogue definitely has the best and most lasting flavor, just wish they made higher nic level than 6",1,sesh nic pouches? anyone?
07/22/2023 17:08,"will agree, the juice head pouches are bad, horrible flavor, too big of a pouch. the 12mg doesn’t even feel like more than an 8mg on",1,sesh nic pouches? anyone?
03/31/2023 23:18,got mine today... 4mg mango.  the pouches are surprisingly stiff and dry.  not much flavor but i kinda prefer it this way.,4,sesh nic pouches? anyone?
03/31/2023 23:33,"thanks for the update. that's what i ended up ordering most of, mango, 4mg also. as long as they don't have a moldy taste like frē does, i'll be good.",2,sesh nic pouches? anyone?
03/31/2023 23:47,"they seem to kick a little harder, i got a little buzz from 4mg which hasn't happened in a while.  i'm curious if anyone else gets stiff pouches since they advertise as moist.",3,sesh nic pouches? anyone?
04/04/2023 10:28,"the pouches seem to be more full than most, which makes them seem stiff. the ones i got aren't powder dry, you can tell there is a little moisture in it. somewhere around a l!x or 6mg fre pouch.",3,sesh nic pouches? anyone?
04/02/2023 16:23,"ups delivered mine today and they're a bit dry and stiff but not bad. i mean they're not like a board where you can knock it against something. they're not bad tasting either, and the nicotine level seems to be about right. i've tried the mango and wintergreen so far. i also ordered a bunch of mint but haven't tried those yet.",2,sesh nic pouches? anyone?
05/25/2023 05:16,"i bought a bunch of them and i don't know what to think of them yet. seems to irritate my lips and throat more than most. zyn i can use 24 hours a day, but these start to get to me after a few mins. i really just wish a company would completely rip off zyn's recipe and put 20-25 pouches in a can for $3 or less.",3,sesh nic pouches? anyone?
05/25/2023 10:16,"i'm the opposite. i'm on my 2nd order of them now since i posted this. though they're not my favorite, i think they're okay. especially since they've been selling them for $2 or whatever. zyn makes me nauseous. i know they're popular and people like them, but there's something in them that doesn't agree with me.",1,sesh nic pouches? anyone?
07/22/2023 17:10,"interesting i’ve noticed this from zyns as well, i figured i had just had too many pouches in too little time. but rogues and on don’t do that",1,sesh nic pouches? anyone?
03/28/2023 05:28,"im going to fo the same from nicokick... even if they suck, they're $2/ can for the moment.",2,sesh nic pouches? anyone?
03/29/2023 01:33,tell ya when they arrive. ordered 5 of each in 6mg to try out. hopefully soon enough to decide if they're good so i can order more while they're still $2 a can. :),2,sesh nic pouches? anyone?
03/30/2023 21:43,"ordered some myself, my go to is the nic-s orange, but for $2 a can i ordered 10 cans lol should be here tomorrow",2,sesh nic pouches? anyone?
04/26/2023 22:26,been using the mango 6 and honestly like them a lot. i get them at the store so not dry and the flavor is light.,2,sesh nic pouches? anyone?
04/27/2023 09:22,"yeah, they're not bad. they're not my favorite brand but i'll definitely pick a lot up when i see them on sale online. i've still got a bunch of them from the order i made right after posting this.",1,sesh nic pouches? anyone?
08/19/2024 15:22,you’ll like fre and sesh and zone,2,sizes/shapes
07/09/2024 12:59,"that cucumber lime zyn sounds interesting. damn why does europe have all the cool flavors? here in the us we're mostly stuck with velo, rogue and on beyond zyn. it's just awful. found a place where they were selling lucy breakers (made in sweden) and other than the fact i didn't care for the flavor thing in them i loved them. so i ordered a bunch of lucy and even a couple sesh from nicokick and they still haven't shipped. but it's only been like 24 hours. just a drag when they literally tell you they ship everything within 24 hours.",1,"snusme order landed, didn’t get held up in customs this time 🥳"
05/19/2024 23:36,sesh is good stuff.a buddy of mine blends that.  they put a lot of work and craftsmanship into it,4,still can’t find zyn but my gas station started carrying these.
05/20/2024 05:23,"sesh is a good alternative to zyn, i maybe like it even more (especially mango)",2,still can’t find zyn but my gas station started carrying these.
05/21/2024 00:14,i personally do like sesh but i did get tired of them but they are really good,1,still can’t find zyn but my gas station started carrying these.
11/26/2023 13:16,you gonna get to it once you're done with the old faithful there?,8,stoked to try this mango sesh
11/26/2023 15:50,i just wanted to try something different but i dont like it,3,stoked to try this mango sesh
11/26/2023 13:25,i really enjoyed lucy mango. worth a try if you find yourself becoming a mango fan,4,stoked to try this mango sesh
11/26/2023 22:47,to me sesh flavor was muted and the pouches were on the hard side like they were old. not worth imo,4,stoked to try this mango sesh
11/27/2023 09:47,you have any recommendations for more of a moist pouch with better flavor?,1,stoked to try this mango sesh
01/24/2024 21:38,"i haven't tried sesh but i recently got lucy, i like the mango and mint (painful) a lot, apple ice and wintergreen are okay. coming from zyn and i do like the moisture in them.",1,stoked to try this mango sesh
02/14/2024 03:20,the sesh sucked fyi lol tasted like burnt popcorn,1,stoked to try this mango sesh
02/14/2024 03:58,good to know! highly recommend lucy mango,2,stoked to try this mango sesh
02/15/2024 01:15,"i’ll have to check that out, i love a good mango flavor",2,stoked to try this mango sesh
11/26/2023 16:33,sesh pouches made my teeth feel weird. don’t really know how to explain it other than like the pouches turn into sand after a while. flavor is alright but the texture just kills it. didn’t really like their mint or wintergreen flavors either.,2,stoked to try this mango sesh
11/29/2023 22:17,i become so nasueas at the sight of spearmint zyns lol,2,stoked to try this mango sesh
12/02/2023 18:53,damn really lol hopefully that doesn’t happen to me because i love them,1,stoked to try this mango sesh
11/26/2023 13:34,let us know how it tastes brother! im interested,1,stoked to try this mango sesh
11/26/2023 15:49,not great lol like mango flavored popcorn,3,stoked to try this mango sesh
11/27/2023 00:11,o jeez. that’s disappointing &amp; seems weird,2,stoked to try this mango sesh
11/27/2023 09:46,yeah it definitely was,2,stoked to try this mango sesh
11/26/2023 14:33,not a fan of them tbh. they got all dried out and the flavor was a little too artificial.,1,stoked to try this mango sesh
11/26/2023 15:49,yeah tastes like mango flavored pop corn 😂😂,3,stoked to try this mango sesh
11/30/2023 11:15,i'm glad it wasn't just me who smelled popcorn when trying these,2,stoked to try this mango sesh
04/21/2023 18:20,"i use 3-4 zyn pouches in a workday. one in the morning as my caffeine kicks in, usually 9-11 ish one in the afternoon for my second work focus sesh: 1-3 ish. one after working out, 7-8 ish. one more after dinner, 9-11 ish. pros: seems to help me focus i enjoy the taste and feeling significant mood boost sometimes curbs appetite. a zyn and a 0 calorie 7 up get rid of my hunger for hours. cons: im addictedcan make me anxious exacerbates headaches occasional heartburn and hiccups probably counts as “low effort dopamine”, which is apparently not good.",5,strategic nicotine use for afternoon focus and productivity
07/05/2024 18:35,"it’s just an alternative nicotine device. first was cigarettes and chewing tobacco. bad for you but feels good. then came vaping or “electronic cigarettes” - not as bad health-wise, so a better way to still get your nicotine fix.now you have zyn (and many others such as on!, rogue, velo, zone, frē, sesh, etc.) i think the first real ones were snus but they really didn’t catch on, until now. zyn is the big name brand kingpin that’s basically like the coca-cola or marlboro of the pouch world. basically just nicotine salt in a pouch you put in your lip similar to chewing tobacco, without all the bad byproducts of the tobacco - just pure nicotine getting dissolved into your bloodstream, which gives you a buzz. much safer and healthier than any of the alternatives.(hell - they even make *coffee pouches* under the brand “grinds” which are basically ground coffee in a little pouch you put in your lip? i guess you can suck on them to get that caffeine into your system without all the having to drink liquid? idk)",5,there is no better start to the day
06/30/2024 23:14,"imo, zone, fre, rogue (if your gums can handle it) are all better. us velo is trash, juice head is trash. i still wanna try sesh, lucy, lucy breakers.",1,the zyn shortage is effecting me :(
07/01/2024 00:24,"the mint fre are my least favorite. the wintergreen is really good, i like the sweets whenever i was something without flavor and the lush is alright i guess. i've seen sesh on nicokick too, they look good and i think they are on sale right now so i'm gonna test them",1,the zyn shortage is effecting me :(
04/30/2024 15:50,in my opinion the best nicotine pouches sold in the u.s. are rouges and sesh.,-2,trash. 
04/28/2024 13:48,seems a bit wild. just set a timer on your phone if your trying to schedule your vape sesh.,1,trying to quit. has anyone tried using time lock safe to extend the length of breaks?
05/20/2023 07:26,rogue tore the shit out of my gums after one day. switched to sesh.,1,trying to quit vaping by using pouches but my gums are killing me
07/07/2024 12:00,fre is a good one too! similar to swedish pouches...sesh is superior imo,2,"us velos are cheeks, how much better are the swedish ones? "
07/07/2024 12:09,i’ve been needing to try sesh mango for a while now. but ya know.. it’s hard to not order the norm lol,1,"us velos are cheeks, how much better are the swedish ones? "
07/07/2024 12:32,i heard that! mango sesh are so good! i have a can that i've been picking at here n there lol living in cali have too order it. good thing a few stores near me sell flavored pouches,1,"us velos are cheeks, how much better are the swedish ones? "
07/06/2024 23:47,"swedish brands like xqs, nic-s, and sesh aren’t too bad. found some in my city. xqs and sesh pouches feel pretty comfortable.",2,"us velos are cheeks, how much better are the swedish ones? "
02/03/2024 07:58,"i'm using a gum called ""sesh"" with 4mg nicotine content- it's great for focus especially going to class/lectures",3,vaping without nicotine and chewing nicotine gum. which is better for health?
03/17/2024 06:50,sesh is very close i don’t know why no one talks about them but i’ve stopped ordering from overseas once i found them. limited on flavor options but the ones they have are great,1,what's an american pouch similar to european velo?
07/14/2024 13:18,sesh mint 8mg,1,what’s everybody dipping on today?
07/14/2024 17:49,sesh wintergreen 6,1,what’s everybody dipping on today?
08/24/2024 01:24,"true but it's annoying as hell they're taking away 2 flavours,meanwhile i bought cinnamon flavoured sesh gum which are displayed right up at the checkout counters. makes no sense. i'll gladly let the gov restrict nic gums in exchange for zonnic to be let out of the cage,lol.",3,what are we doing now that zonnic is effectively banned? (canada)
08/02/2024 17:32,fre or sesh are good choices!,2,what brands of moist pouches are available in american stores?
11/29/2023 02:27,im in manitoba and there’s an insane amount of demand with no supply. all stores sell out within half an hour of delivery if they even get the delivery.. 711 has sesh gum as an alternative option but it does not sell at all. debating switching to it just to have something to curb the nic cravings from quitting vaping,2,what happened to zonnic in canada?
12/11/2023 19:06,"i’ve been using sesh since i posted my original comment and it does help quite a bit, but zonnic actually takes the vape craving away where i’m finding sesh is only making me crave vaping more 🫠",2,what happened to zonnic in canada?
05/19/2024 23:39,bought a sesh mango when picking up zyns. not terrible. i want to try the mint ones next to compare.,1,what product is closest to zyn? 
07/03/2024 01:27,"that's a really interesting idea as somebody who also hates dry pouches. i was also surprised by fre, i've only tried lush but it's probably the third best brand i've tried after lucy and sesh. only tried the sesh mango as well, looking to try some of their minty flavors.",1,what went wrong 
12/19/2023 17:29,i’ve been looking everywhere as well and i think there’s a shortage. it’s really helped me with quitting smoking and now they’re out everywhere.. now i’m using a nicotine gum called “sesh” and it’s helping but i’m not a fan of gum in general.,5,where are all the zonnics?!?
04/08/2024 04:42,"lucy, sesh, zone, fre and rogue are all moist",2,where to find moist pouches in usa?
04/07/2024 23:29,try sesh. they sell them in on northerner and nicokick as well as the sesh website. they have been my daily for about 2 months since i quit vaping,1,where to find moist pouches in usa?
04/08/2024 12:46,sesh mint jor frē sweet pouches are my go-to,2,where to find moist pouches in usa?
08/13/2024 03:21,sesh is my favorite. i get them online but they’re so easy on my gums that i’ll throw in a zone with them just to spice things up. sesh is my unwind type of pouch.,1,which pouch is easiest on the gums?
06/10/2024 13:00,"fré, zone, sesh, lucy breakers, nic-s are all moist american brands. i get all mine online, but i've seen people on here find some of these brands in stores",7,why does the us only get dry portions? 
06/10/2024 17:05,"lucy and frē are considered moist pouches. i haven't tried any of the newer brands like sesh, ubbs or zimo. when i came back to np's i went straight to eu pouches",1,why does the us only get dry portions? 
08/22/2024 16:35,"they're not bad, and they last a while too.  it was a one and done for me because of the size.  the rogue is twice as big as a xyn.  i've read about messing up your gums, or receding gums, something like that, so i've stuck with the xyn chill 3 mg (my favorite).  if on budge, the on! brand isn't bad at all.  i still haven't tried velo, sesh or zone.  does anyone know if those ones are worth trying?",1,why do i hear so much bad about rogue pouches?
03/17/2024 22:53,"8mg is just kind of viewed as a higher end of the unofficial ""standard"" strength, and anything 1mg-8mg is just an accepted framework in the us. i can only think of fré and juicehead being the only two widespread quasi locally available pouches that exceed 8mg (granted lucy, nic-s, sesh, and others are available online.) vape liquids were commonly in the same ball park (3-12mg being fairly standard) yet many, many companies would offer up to 24mg, and once refillable pod systems became available, the same 50mg that was once relegated to disposable/prefilled vapes became fairly common. i used to think it was odd that pouches relegated themselves to the low end versus vaping that grew exponentially to fill any and all offerings. then again, vaping was attacked and is now a shell of what it once was, so maybe they are iffy about drawing even more attention then they already are. then again, vape products weren't subject to the 2009 ""family smoking prevention and tobacco control act"" until 2016, and still further time until they were informed that they were subject to the pmta requirements of tobacco products. currently synthetic nicotine products are exempt from the act, but that could easily change at anytime as it did with vape products. tl:dr; the us market has had a ""standardized"" mg range for products for a long time. if swedish match/zyn didn't try to bring higher mg products to market previously, they almost certainly won't do it now as senator schumer is beating the war drums against zyn with their current 3mg/6mg offerings.",9,why don't we get these strengths in the us?
06/26/2024 15:44,"lucy is the best pouch i've tried in the u.s. mango and mint are my favorites, don't care for the other flavors. sesh mango is pretty good too, though i've only seen them at buc-ee's, not sure if you have them over there.both of these are *leagues* better than zyn imo",2,zyn shortage 
06/26/2024 23:07,"lately ive  been on the hunt for sweden pouches. they are the softest and doesnt seem to mess with my gums. i was lucky to find some called sesh, xqs, and lucysesh and xqs were nice and comfortable. not extremely sweet.there will be spots out there that have em still at a premium. im in ca",2,zyn shortage 
06/07/2024 23:07,sesh wintergreen isn’t terrible. wet pouch and the flavor lasts a while,0,zyn wintergreen alternative
06/08/2024 08:13,"sesh wintergreen is insanely good, but you have to order it online",0,zyn wintergreen alternative
