date,text,score,title
05/10/2024 14:50,"i run a small hedge fund based out of raleigh, nc. myself and my fund are long $haypp. please see the disclaimer at the bottom of the post. for more blog posts like this check out my fund's blog at [https://www.rogue-funds.com/blog](https://www.rogue-funds.com/blog)*all financial figures are in usd unless otherwise specified.*i think haypp group, the biggest online retailer of nicotine pouches, can capture a huge chunk of the sales in what i believe will be the biggest form of nicotine intake growth over the next 10-15 years.the future of nicotine consumption will be nicotine pouches and it is growing at an unprecedented rate. here in the states the go to item for nicotine pouches are zyn’s (owned by philip morris), in europe it’s velo (owned by british american tobacco), but there are various other brands that all catching fire: on! (altria), rogue, juice head, fre, lucy, and sesh, among various others.**what is haypp?***brief history*haypp is an online retailer and distributor of nicotine pouches and snus. the company was started by a couple of swedish teenagers in 2009 and through mergers and acquisitions they no longer are in charge of the company as the current ceo joined in 2017/2018. the company bought nicokick.com and northerner.com (northerner owns 9% of stock) which are now both of their main american brands. they switched from snus to nicotine pouches 6 years ago and haven’t looked back.[domains owned by haypp group](https://preview.redd.it/gr3kxwm5anzc1.png?width=975&amp;format=png&amp;auto=webp&amp;s=383bb5d7ac692fe7323192c608ae812b46f4e7c1)haypp currently owns a roughly 85% online market share for their nordic part of the business, which they refer to as their “core” business as well as a \~55% market share of the oral nicotine market (85% market share of the nicotine pouch e-commerce market) for their growth market which is considered the us, uk, germany, and swiss countries.[market share of haypp](https://preview.redd.it/r9y53fg7anzc1.png?width=975&amp;format=png&amp;auto=webp&amp;s=b11912ca8e532bc15d9b2d918bc4fa2673c3a917)[haypp vs closest competitor in each market](https://preview.redd.it/dsu4sxm8anzc1.png?width=975&amp;format=png&amp;auto=webp&amp;s=82be786825f001a4617db95ea6b88795b16aaeb0)*seo powerhouse*so how do they have such a grasp on what would obviously be a hyper competitive online industry? the main reason for their hyper success in the online market is that they have a death grip on the seo landscape. their mastery of seo allows them to spend almost nothing on marketing and to keep pushing out their distribution system (which continues to drive costs down for them and consumers). this creates a positive feedback loop as they become even cheaper than their competitors, allowing them to lock in customers (over 90% of the customers becoming recurring customers).[how consumers find haypp](https://preview.redd.it/qevmp0qaanzc1.png?width=643&amp;format=png&amp;auto=webp&amp;s=ad031f2035197c31f321a03926d954b33f2357b4)[haypp marketing expenses as a &amp;#37; of sales](https://preview.redd.it/fru8h8xbanzc1.png?width=683&amp;format=png&amp;auto=webp&amp;s=5a9e6014be0a78d76582c962afb0219ebfd53778)if you google just about anything related to nicotine pouches, there is probably a 95%+ chance that the top unpaid search result will be a haypp group domain. even niche searches such as “what is an upper decky” (gen. z slang for nicotine pouches) or basic searches such as “what are the top nicotine pouches” you will see that haypp group owns the top of the search.https://preview.redd.it/e7ocu0jdanzc1.png?width=975&amp;format=png&amp;auto=webp&amp;s=f8e80b8d743de3dc9133504bd6ff85dbbaee48bb[google searches highlighting the seo power of haypp](https://preview.redd.it/symd8zueanzc1.png?width=975&amp;format=png&amp;auto=webp&amp;s=176783915281075fdb07a1b83ee6b18f2978f24c)this is huge when sites like google severely limit the amount of advertising that addictive products can utilize on their search engine. haypp ends up barely spending anything on marketing due to 40% of new customers coming through word of mouth and the rest from seo.*data*their other field of expertise is data collection and selling. due to the large variety of pouches and being the number one online seller of nicotine pouches, they have created a major database which they sell to various nicotine pouch producers such as philip morris and altria. producers buy these on an annualized basis, and you can see the usage of their data among the investor relation reports/presentations/websites of various producers. as you can see from my beautiful pictures on this post, they compile plenty of data to help me understand the business better. *lowest cost seller and best e-commerce distribution*due to their distribution network, haypp has become one of the cheapest (if not the cheapest) sellers of nicotine pouches in the world. you can buy zyn’s cheaper from haypp websites than you can from the zyn website. haypp’s prices are 20-40% cheaper than grocery stores and 30-50% cheaper than convenience stores.they have been integrating their distribution network so that most variable costs are being converted to vertical fixed costs creating operating leverage for them as they rapidly scale their revenue and are able to increase margins. they have implemented 2-day delivery across the us and close to implementing across europe markets as well.https://preview.redd.it/0sajvfgkanzc1.png?width=975&amp;format=png&amp;auto=webp&amp;s=3aad16b9df1be7bf6bbcc8f16ebf8c469c15b3a0[haypp distribution](https://preview.redd.it/cbanlyvlanzc1.png?width=975&amp;format=png&amp;auto=webp&amp;s=537d2414b3c56538902bbf1594f78fe77b44f089)*leveraging market share for high quality new products*the last part of their business model is their ability to leverage their large consumer base to help new products capture market share, which allows them to capture higher margins on their products and it increases the variety of products which consumers would like to buy. in nordic countries the variety of products is a benefit to them as consumers want to try various brands and flavors. when this competition trend hits the us it will only benefit them even more. **why haypp vs pouch companies**currently in the us there are only a couple main brands with zyn owning a huge chunk of the market. in europe, velo is the most popular brand but there are many nordic brands that consistently attack margins and currently there is little competition in the us market which most likely won’t last much longer. as consumers search out the cheapest product and try to hunt for variety, haypp will be that future as convenience stores lag in variety and cost.products such as zyn will definitely continue to grow (currently zyn is growing at 70% y/y) but we could see margins shrink as competition becomes fiercer and consumers branch out away from the first movers, although zyn continues to take up 70% of the us market. this only further benefits haypp as they are the go-to spot for a large amount of variety. although they don’t benefit as much from less competition, they are still beneficiaries of an oligopoly esque market due to their cost and distribution networks.most large publicly traded pouch companies are also cigarette and chewing tobacco sellers who are rapidly seeing those segments get cannibalized by vaping and nicotine pouches combined with regulatory crackdown risk. since haypp has no exposure to either one, you will not experience any cannibalization outside of snus cannibalization in the nordics. this is the best pure play bet on nicotine pouch consumption.certain countries have limited the ability for consumers to have access to nicotine via retail stores which will allow them to take huge shares of the overall market in places like germany or in california where they have banned flavored nicotine products in retail stores has led to windfall of customers to haypp’s e-commerce model. **management**the current ceo of haypp group, gavin o’dowd, used to work for british american tobacco (bat) and was the driving force for the velo acquisition. he currently owns 3.6% of the stock and various other pe firms and family offices own large chunks of haypp. most executives have warrants that could give them the right to 200k-400k shares each (29m shares outstanding with no serious history of dilution). **regulations**as many of you are aware, regulations are a huge part of the nicotine industry. taxes are going to be huge risks, which are then combined with flavor bans. i think nicotine pouches are one of the products that are least likely to get hit with serious bans since their health risk is much lower than almost any other nicotine product.the nicotine pouch industry as a whole has been behaving spectacularly well when it comes to ensuring they are not purposefully marketing to young people. they are trying to avoid having a juul 2.0 fiasco which basically murdered that business and completely fragmented the vaping industry which is on the brink of regulatory crack down.haypp does their part by ensuring age regulation across their whole site. they have age verification to order and deliver. they have a huge emphasis on ensuring that they abide by the law. **financials***core segment (nordic countries)*the company is growing heavily in every segment that it operates in. its core segment seems to be slowing down in growth due to heavy cannibalization from snus sales. this should only be temporary as nicotine pouch volume grows at 30%+ y/y. once snus nears its cannibalization endpoint, i would expect revenue to begin growing again in its core market (although not at 30%). current revenue is $250m usd and ebitda is about $18m usd for just the core segment for the last twelve months. management expects high single digit ebitda margins for 2025.[core segment sales and ebitda margin](https://preview.redd.it/yzcdzgtoanzc1.png?width=526&amp;format=png&amp;auto=webp&amp;s=b25fafa6bcdf821a4a36de2cafa09aaa625b67bf)*growth segment (us, uk, germany, switzerland)*the growth segment is skyrocketing. growth is over 46% y/y and this growth has been consistent and should continue to be consistent. ebitda margin for the growth markets has begun to inflect positively which will cause a massive amount of leverage in their ebitda to occur as their fixed cost model begins to do its job. as economies of scale drive forward, we should see this margin increase substantially over the coming years. currently revenue is at $77m usd for growth markets and ebitda is at -$3.5m usd.[growth segment sales and ebitda margin](https://preview.redd.it/5dwt225qanzc1.png?width=515&amp;format=png&amp;auto=webp&amp;s=09f25d4e92c17667ae4129e1d28e0b3a0be59a9b)*let’s talk about the growth segment a bit more.*this is where the real value from haypp will come into play. while it currently begins to inflect positive in terms of profitability, it should be noted that the growth markets have a massive tam compared to their core market and could cause the company to 5x in the next few years if they maintain or gain market share and continue to grow in these massive tams.*total tam growth*as they grow, their competitive advantage deepens due to sticky customers and cheaper products from economies of scale. the us has an even faster scale of 49%+ growth y/y and haypp is outpacing the us nicotine pouch growth at 57% y/y. as the us begins to approve various products and variety begins to flood the us market, a ton of us users want to try various nordic brands that don’t have access which lends a very strong lean towards an online website such as haypp. the us is a very ripe environment along with the uk and germany (where nicotine can only be sold online) for haypp to continue to outperform massively.*emerging segment*their “emerging” segment is where they have begun to introduce vapes into their value chain. haypp is beginning to sell vapes to uk and germany, but it is at the very beginning stages and has no current significant impact on their bottom or top line. the company says the growth they are experiencing in this segment has been very similar to the growth that they experienced when they introduced nicotine pouches in growth markets. this is the most likely segment to get hit with regulatory concerns, so for now i won’t even consider this in a to be a profitable unit and will just assume it will be a small drain on ebitda for the foreseeable future.*balance sheet*the balance sheet is great with no large debt burden and good working capital management. as they hit profitability this year/early next year i would expect a cash build up until the company decides if they will be returning cash to shareholders or reinvesting in the business. **valuation**haypp is extremely undervalued based on where they are from a profitability standpoint and their current inflection point. due to their high growth, it will be hard to pinpoint an exact value on them so this will merely be an exercise in estimating their value among a range more than usual (anyone who claims they can perfectly value a high growth company is probably overvaluing due to unsound conviction). first let’s look at how they are currently valued, which is roughly 14x their **core** ebitda. now let’s take a second and think about how insane that statement was. their core market is the nordic countries which will be hitting growth again as their snus cannibalization slows, the nordic countries basically have no further regulation risk for nicotine pouches, and it is a noncyclical industry. i would argue that 14x their core ebitda is probably an appropriate valuation based on **only** their core segment.what this means is (if you haven’t noticed already) that you are getting their “growth” segment for **free** based on the valuation of the stock. the growth segment alone is probably worth multiples of the current stock price due to the massive tam and extreme growth prospects. if we assume the emerging segment is worthless (which it isn’t and it will be profitable at some point) then that means all of the upside in the stock can be based on what the value of the growth segment. based on tam, growth, and lack of cyclicality then this leaves the only risk as regulation.there will most likely be some sort of regulation, but we are very far from that as the tobacco industry has been very careful in how they implement their new nicotine pouch momentum in a more appropriate way compared to vapes. the most likely regulations will probably be flavor bans of some sort or retail bans (which further benefits haypp). regulations will most likely be limited in scope due to just the sheer lack of mortality risk associated with pouches vs any other form of common nicotine intake.based on their probable conservative revenue growth (40% average for the next 3 years, and 15% after that), ebitda growth, the fact that they will have both core and growth markets at high single digit ebitda margins in 2025, and their lack of cyclicality, then i would estimate that their growth markets are worth a very conservative $400m-$500m usd. i am likely undershooting the valuation because they are driving profitability very fast and their revenue is growing closer to 40%-60% in growth markets right now. if they are able to keep up current growth figures and expand to double digit margins before the end of the decade then they could be worth 2x-3x this value (which is why valuing growth companies are so hard, because i can’t foresee the future). again, i valued the emerging segment as worthless which is unlikely as well.so, based on the value of $450m usd for the growth markets and the current value of $240 usd for the nordic markets, that would create a sum of the parts equal to roughly $700m or nearly triple the current share price. this valuation leaves a ton of room for margin expansion and higher growth prospects because let’s face it, the us alone is probably worth at least 3x-5x more than the nordic countries not including the uk, germany, or swiss. this is a very conservative valuation for the company, but it shows how great the risk/reward is based on the current price. using a conservative valuation here also helps accommodate for regulation risk.in sek terms this would be 250 sek/share or 7.35b sek.**conclusion**even accommodating for regulation risk, a valuation of $700m seems appropriate as a starting point for the valuation for haypp group. i think there is a very high likelihood that i could be off on this by a large margin, but i feel like the downside is very protected with this valuation. management has been great in execution and i expect that to continue. in a more bullish case where every segment of the company fires on all cylinders we could see a valuation of $1.5b+, but that is not a scenario that i would like to bet my investors’ money on. for now, i will stay invested and keep watching them execute and adjust my valuation accordingly.*disclaimer: the author of this idea and his fund have a position in securities discussed at the time of posting and may trade in and out of this position without informing the reader.**opinions expressed herein by the author are not an investment recommendation and are not meant to be relied upon in investment decisions. the author is not acting in an investment adviser capacity. this is not an investment research report. the author's opinions expressed herein address only select aspects of potential investment in securities of the companies mentioned and cannot be a substitute for comprehensive investment analysis. any analysis presented herein is illustrative in nature, limited in scope, based on an incomplete set of information, and has limitations to its accuracy. the author recommends that potential and existing investors conduct thorough investment research of their own, including detailed review of the companies' sec and csa filings, and consult a qualified investment adviser. the information upon which this material is based was obtained from sources believed to be reliable, but has not been independently verified. therefore, the author cannot guarantee its accuracy. any opinions or estimates constitute the author's best judgment as of the date of publication and are subject to change without notice. the author and funds the author advises may buy or sell shares without any further notice.*  *this article may contain certain opinions and “forward-looking statements,” which may be identified by the use of such words as “believe,” “expect,” “anticipate,” “should,” “planned,” “estimated,” “potential,” “outlook,” “forecast,” “plan” and other similar terms. all such opinions and forward-looking statements are conditional and are subject to various factors, including, without limitation, general and local economic conditions, changing levels of competition within certain industries and markets, changes in legislation or regulation, and other economic, competitive, governmental, regulatory and technological factors, any or all of which could cause actual results to differ materially from projected results.*",5,haypp group: capitalizing on the nicotine pouch craze
03/30/2024 23:56,"just got some tins of a brand called sesh and they're pretty good, soft pouches and good taste sadly mine were dry but they're supposed to be moist i believe, they have 4mg",3,hey fellas what’s the best nicotine pouches other than zyns looking for 3 mg or 4mg at highest ? thanks  in advance 
08/20/2024 16:19,unfortunately white portion is all we have in usa except for sesh pouches,1,how do you care for your gums
05/23/2024 11:01,"zyn, sesh and a variety of other products offer transbuccal nicotine salt patches (no tobacco  and no smoke). they work faster than nicotine lozenges and are the only thing that's kept me off the butts for the past year.",1,how the f do i quit smoking?
06/12/2024 00:44,pretty common actually. paired with coffee by the time i finish my coffee and vape sesh it's time to head to the bathroom.,1,i can only shit with a vape in my hand
07/11/2024 11:41,i fell into that trap.  now i buy swedish nicotine pouches online.  they don't dissolve the same way american zyns do and keep their flavor longer so even after there's no nicotine left in the pouch i still keep it in just for the feel and flavor.  helped me cut down a bunch as i keep one pouch in for a few hours now.  i think sesh is a brand that's available in the states now and is more like the european variants.,3,i hate zyn 
05/06/2024 12:31,i second that on! are garbage. two 8mg feels like one 8mg of a good brand like sesh or lucy,0,"help - in a flavor ban state, what should i try?"
06/02/2023 22:30,try sesh. was easy on my gums.,2,i need to quit rogue
05/26/2024 22:37,sesh wintergreen or mango,3,"in your experience, what is the best flavor of pouch that you have had?"
08/28/2024 14:44,is that a can of sesh down there?,1,it’s gonna be a good day
06/26/2024 20:16,"that works! i usually avoid outlines because it becomes too cumbersome and tedious as my outline essentially turns into my essay without being my essay (idk if that makes sense). i only use outlines to collect my general thoughts and put down my quotes and resources from my research under general subtitles. another thing i do is save your dirty laundry to do for when you really need/want to do a homework sesh, that way you’ll have a reason to stay out of a place of pure comfort and be productive, this way you can better ensure that you’re getting your homework done and completing other mundane tasks like laundry or dishes. one other thing i do is, at the beginning of the term, write down on a notepad (legal writing pad), in different colors, every assignment due and when they’re due along with their score values, and i do this for each class. this way i can satisfy my ocd and organizational desires and distract myself from any anxiety and stress i might be feeling or experiencing from other parts of my life. i hope these tips help you out! if you have any of your own, i’d love to hear them!",1,i think i disappoint my professors
02/27/2024 12:48,"i’ve used zyn, sesh, and on! and zyn has been the only dry one. i’m not sure if it’s custom for pouches to be damp, but the swedish pouches i’ve used have been and have still worked for me",1,"just me, or has nicokick been having quality control issues.."
06/05/2024 18:29,velo is good but eu velo is way better and sesh is actually pretty good since it is a moist pouch because that is what i prefer.,1,latest nicokick order
06/06/2024 00:23,"i just switched completely to sesh from zyn. perfect amount of flavor, slightly sweet, long lasting, better value, and better mouth feel.to add to this. i hate moist pouches and was skeptical when i first tried sesh. but they are barely moist. more like soft? either way i quickly got used to this barely moist pouch",2,latest nicokick order
06/19/2024 14:34,i’ve always wanted to try velo. how are the velos compared to sesh and zynsss. just tried the sesh clear yesterday. they were actually pretty good!,2,latest nicokick order
06/09/2023 12:09,"i've been using zyn cool mint 3mg and 6mg for a year with zero problems on my lips. i'm trying to save money and with zyn being one of the more expensive cans with only 15 pouches i'm looking for alternatives. on is cheap, irritates my mouth. sesh, even worse. looking for a dry pouch that is basically a cheaper zyn clone. anyone know? ",1,least irritating pouches?
07/28/2024 22:21,"try "" sesh "" pouches thank me later",2,looking for no throat burn. 
07/28/2024 22:29,"in my experience, the sesh pouch (espresso/coffee 8 mg) tasted nice and didn’t burn, but was also rather underwhelming in the effect it produced, despite being an 8 mg &amp; 20-30 minute pouch",1,looking for no throat burn. 
07/29/2024 08:58,"sesh only has wintergreen, mint, mango and an unflavored pouch...i think you're thinking of another brand",1,looking for no throat burn. 
07/13/2024 13:11,"recently i had come across lucy breakers at a kwik fill here in the us. i tried the apple ice breakers and thought they seemed pretty good but would be better without the flavor pack in them. btw these breakers said ""made in sweden"" on the cans.so i got on nicokick and placed my first order ever. i went with 4mg cinnamon, 4mg wintergreen and 4mg  apple ice. i got 11 of them altogether and even added 3 of the 4mg sesh wintergreen. they arrived today and i see they are made in china on the side, but they looked ok. wrong. the cinnamon and wintergreen have the same awful flavor to them. cinnamon tastes nothing like cinnamon. wintergreen had that off flavor with a hint of wintergreen being overpowered by it. the apple ice seemed ok didn't notice this off flavor to them they are just super fruity.personally i feel like they are a waste of money. american zyn are better than this. they hit hard though imo. the sesh were definitely better and they are made in sweden so that's probably why.are there any better quality pouches that you don't have to order from europe? ",2,lucy pouches wtf
07/13/2024 17:52,"ya they really do! the breakers were weirdly better quality so it's like wtf lucy? the sesh are ok though, but nothing special.i guess i'll have to order actual swedish pouches but really don't want to pay that much for shipping.curious to try fumi and helwit.",1,lucy pouches wtf
10/14/2023 15:58,"i liked the dragonfruit in 9 but wanted the 6.  any recommendations for fruit flavors that taste great and last that long.  juice head sucks, zyn taste good but don’t last. on are just not good.  do fre taste good?  the strength scares me the 9mg lix make me sweat sometime… lol.  i tried the sesh mango and it was decent.  may go with those.",2,l!x (lix) pouches discontinued
